{
  "body": {
    "identifiers": [
      {
        "persisted": false,
        "version": 0,
        "type": "prebid_id",
        "value": "2e71121a-4feb-4a34-b7d1-839587d36390",
        "source": {
          "domain": "operator.prebidsso.com",
          "timestamp": 1643041140000,
          "signature": "/97uDMKRyaW1v2MH4UbU6UNRft/v+1bJV0vpmArVc3l9ErOhCuM2nsewgAI5w9HjFJbzvdLlTOTlTjTlZCdw8w=="
        }
      }
    ]
  },
  "sender": "operator.prebidsso.com",
  "receiver": "advertiser.com",
  "timestamp": 1643041150000,
  "signature": "GIqz3qO/aYp/tCs1wLD/t4UQJul0RZ2HgxnWGHGMRi42Wl6FUqrrEoiIp1V5YkpVABqzwsZ0SXSRybnbAtYNUg=="
}