{
  "body": {
    "identifiers": [
      {
        "persisted": false,
        "version": 0,
        "type": "paf_browser_id",
        "value": "2e71121a-4feb-4a34-b7d1-839587d36390",
        "source": {
          "domain": "operator.prebidsso.com",
          "timestamp": 1643041140000,
          "signature": "PPhtH9vaPP1SXeGXOFzOcMmbOiJ/3or0+o5YUli0NQfgLQ087kuAAUvivPkcyyRza1Eorq7C1EXmmJRxEBRp8A=="
        }
      }
    ]
  },
  "sender": "operator.prebidsso.com",
  "receiver": "advertiser.com",
  "timestamp": 1643041150000,
  "signature": "yjglI9Fq8jfHTOk2PjE+coq8oLwsSbULoBh96tv8o4njN6v0bFUl0S1vD3Dq9Jz++7ibbUEzYA5ujaCR1QASfw=="
}