{
  "body": {
    "identifiers": [
      {
        "version": 0,
        "type": "prebid_id",
        "value": "7435313e-caee-4889-8ad7-0acd0114ae3c",
        "source": {
          "domain": "operator.prebidsso.com",
          "timestamp": 1642504380000,
          "signature": "RYGHYsBUEwMgFgOJ9aUQl7ywl4xnqdmwWIgPbaIowbXbmZAFKLa7mcBJQuWh1wEskpu57SHn2mmCF6V5+cESgw=="
        }
      }
    ],
    "preferences": {
      "version": 0,
      "data": {
        "opt_in": true
      },
      "source": {
        "domain": "cmp.com",
        "timestamp": 1642504560000,
        "signature": "HmnCaXySi8u1/qx9YlKA6cTU8L6HAydywDOpJjoLd+Bz+X93APaRXJ1yDJsTC95EPC29ESAisxQ2LsNF6ZSERA=="
      }
    }
  },
  "sender": "operator.prebidsso.com",
  "receiver": "cmp.com",
  "timestamp": 1643097663000,
  "signature": "S/Iz2+aEmD/j46J0Brq36BY3WZw8WVmv9TApCfplbB+c5EnG9jzStnplC1O8evn608nnVFiq3fvHSuQgkiMgrw=="
}