{
  "body": {
    "identifiers": [
      {
        "persisted": false,
        "version": 0,
        "type": "paf_browser_id",
        "value": "2e71121a-4feb-4a34-b7d1-839587d36390",
        "source": {
          "domain": "operator.pafdemo.com",
          "timestamp": 1643041140,
          "signature": "TcoSmz8xSfQIqlIa3RT9XItd7wkvnKWO6UeUjCy52Cn+O4rBXjwkm934ufZRyfM9ylrepQDPJlCSy/eEZxeAMw=="
        }
      }
    ]
  },
  "sender": "operator.pafdemo.com",
  "receiver": "cmp.com",
  "timestamp": 1646157887,
  "signature": "P+qBGqTLdX4GiTkkkozpxpCxzAnEJ9hWSrZWZmP5j82gtlM5JYG7dt8GAUTm9Ens763kWVg7bDm/UzG1To7egg=="
}