{
  "body": {
    "identifiers": [
      {
        "version": 0,
        "type": "paf_browser_id",
        "value": "7435313e-caee-4889-8ad7-0acd0114ae3c",
        "source": {
          "domain": "operator.prebidsso.com",
          "timestamp": 1642504380000,
          "signature": "Oiwt1PFNSJvhQQqpnmqS2jG1jc5pD1vDN/ZU+Diy2ohzGTd4AL2VF6REUOSseitMhVYk4LkYD2IsRXT1hkw5nQ=="
        }
      }
    ],
    "preferences": {
      "version": 0,
      "data": {
        "use_browsing_for_personalization": true
      },
      "source": {
        "domain": "cmp.com",
        "timestamp": 1642504560000,
        "signature": "OFgRb5njIf+HCmYHVM9IbEUoA90ZZL4wTlFDpPc+APSWAD4eCSclOzRV5i4LOlyyuu2Rkl+jAt2DC0UD1bVGiA=="
      }
    }
  },
  "sender": "cmp.com",
  "receiver": "operator.prebidsso.com",
  "timestamp": 1643097660000,
  "signature": "gKN9yh5fzM0mrVglfoOuOOeic6QzAyrGcRdqIHpLLFluxfqKZGaLVa/BRz+4I2HaxXq2siX8ge7UD5C6LljPOg=="
}