{
  "body": {
    "identifiers": [
      {
        "version": 0,
        "type": "prebid_id",
        "value": "7435313e-caee-4889-8ad7-0acd0114ae3c",
        "source": {
          "domain": "operator.prebidsso.com",
          "timestamp": 1642504380000,
          "signature": "RYGHYsBUEwMgFgOJ9aUQl7ywl4xnqdmwWIgPbaIowbXbmZAFKLa7mcBJQuWh1wEskpu57SHn2mmCF6V5+cESgw=="
        }
      }
    ],
    "preferences": {
      "version": 0,
      "data": {
        "opt_in": true
      },
      "source": {
        "domain": "cmp.com",
        "timestamp": 1642504560000,
        "signature": "HmnCaXySi8u1/qx9YlKA6cTU8L6HAydywDOpJjoLd+Bz+X93APaRXJ1yDJsTC95EPC29ESAisxQ2LsNF6ZSERA=="
      }
    }
  },
  "sender": "cmp.com",
  "receiver": "operator.prebidsso.com",
  "timestamp": 1643097660000,
  "signature": "rh5xZm+eoSwsmxMO0CKD/bhXor8IZEJc7YrhQZHw7HGsdmX4rqW2Ra4Mp4ZQf1ltIe/otu1Ot296CwSL5HUljA=="
}